{
  "$schema": "https://json-schema.org/draft/2020-12/schema",
  "$id": "https://codevetter.com/schemas/agent-task/acceptance-contract-v1.json",
  "type": "object",
  "additionalProperties": false,
  "required": [
    "schema_version",
    "task_id",
    "task_defining_failures",
    "required_checks",
    "regression_checks",
    "driver",
    "repetitions"
  ],
  "properties": {
    "schema_version": { "const": "codevetter.agent-task-acceptance.v1" },
    "task_id": { "$ref": "./common.schema.json#/$defs/id" },
    "task_defining_failures": {
      "type": "array",
      "minItems": 1,
      "maxItems": 100,
      "uniqueItems": true,
      "items": { "$ref": "./common.schema.json#/$defs/id" }
    },
    "required_checks": {
      "type": "array",
      "minItems": 1,
      "maxItems": 100,
      "items": { "$ref": "#/$defs/check" }
    },
    "regression_checks": {
      "type": "array",
      "maxItems": 100,
      "items": { "$ref": "#/$defs/check" }
    },
    "driver": {
      "type": "object",
      "additionalProperties": false,
      "required": ["path", "sha256", "timeout_ms"],
      "properties": {
        "path": { "$ref": "./common.schema.json#/$defs/relativePath" },
        "sha256": { "$ref": "./common.schema.json#/$defs/sha256" },
        "timeout_ms": { "type": "integer", "minimum": 10, "maximum": 60000 }
      }
    },
    "repetitions": { "type": "integer", "minimum": 2, "maximum": 5 }
  },
  "$defs": {
    "check": {
      "type": "object",
      "additionalProperties": false,
      "required": ["id", "label"],
      "properties": {
        "id": { "$ref": "./common.schema.json#/$defs/id" },
        "label": { "type": "string", "minLength": 1, "maxLength": 160 }
      }
    }
  }
}
