{
  "schema_version": "codevetter.agent-task-acceptance.v1",
  "task_id": "update-real-parser-not-decoy",
  "task_defining_failures": ["zero-config-value-preserved"],
  "required_checks": [
    {
      "id": "zero-config-value-preserved",
      "label": "The real parser preserves numeric zero"
    }
  ],
  "regression_checks": [
    {
      "id": "lookalike-decoy-unchanged",
      "label": "The unrelated lookalike module remains byte-identical"
    },
    {
      "id": "parser-fallback-preserved",
      "label": "Positive parsing and invalid fallback remain correct"
    }
  ],
  "driver": {
    "path": "checks.mjs",
    "sha256": "484381754ffc98228b84bb63c68f16e8b0dd02310d4c1648cefd4f7fdf017e3e",
    "timeout_ms": 5000
  },
  "repetitions": 2
}
